Company,Symbol proposed,Lead Managers,Shares (Millions),Price Low,Price High,Est. $ Volume,Expected to Trade,SCOOP Rating,Rating Change
MaxsMaking,MAMK,Joseph Stone Capital,2.0,4.00,4.00,$ 8.0 mil,7/7/2025 Priced,S/O,S/O
Mega Fortune Co. Ltd.,MGRT,D. Boral Capital (ex-EF Hutton),3.8,4.00,5.00,$ 16.9 mil,7/7/2025 Week of,S/O,S/O
Masonglory Ltd.,MSGY,D. Boral Capital (ex-EF Hutton),1.5,4.00,6.00,$ 7.5 mil,7/8/2025 Tuesday,S/O,S/O
Ten-League International Holdings Ltd.,TLIH,Bancroft Capital LLC,2.2,4.00,5.00,$ 10.1 mil,7/8/2025 Tuesday,S/O,S/O
Globa Terra Acquisition Corp.,GTERU,D. Boral Capital (ex-EF Hutton),15.2,10.00,10.00,$ 152.0 mil,7/9/2025 Wednesday,S/O,S/O
K-TECH SOLUTIONS CO LTD,KMRK,American Trust Investment Services,2.0,4.00,4.00,$ 8.0 mil,7/11/2025 Friday,S/O,S/O
"Cre8 Enterprise, Ltd.",CRE,American Trust Investment Services/Prime Number Capital,1.5,4.00,5.00,$ 6.5 mil,7/14/2025 Week of,S/O,S/O
Delixy Holdings Ltd.,DLXY,Bancroft Capital,2.0,4.00,5.00,$ 9.0 mil,7/14/2025 Week of,S/O,S/O
FG Holdings,FGO,American Trust Investment Services/Revere Securities,2.0,4.00,5.00,$ 9.0 mil,7/14/2025 Week of,S/O,S/O
